Type,Name,Title,Link,Author,AuthorGH,ScreenshotUrl,Description,SP2019,Categories,ColumnTypes,Tokens,Operators,Actions,Features,Classes
View,retail-account,Retail Account Sample,https://github.com/pnp/sp-dev-list-formatting/tree/master/view-samples/retail-account,Vesa Juvonen,VesaJuvonen,,,,,Currency,,,,,
View,rota-css-table,Staff Rota Shifts View Format,https://github.com/pnp/sp-dev-list-formatting/tree/master/view-samples/rota-css-table,Ariel Kropp,arielkropp,https://raw.githubusercontent.com/pnp/List-Formatting/master/view-samples/rota-css-table/assets/screenshot.jpeg,This is a sample that uses `rowFormatter` to customise the entire display of a row. The aim is to demonstrate the following concepts:,,,General,,,,,
View,search-tag-format,Search Tag format,https://github.com/pnp/List-Formatting/tree/master/view-samples/search-tag-format,André Lage,aaclage,https://raw.githubusercontent.com/pnp/List-Formatting/master/view-samples/search-tag-format/assets/SearchWordTag.gif,This sample includes format to allow search word in field and allow to include tags in Choice field.,,,,,,,,
View,small-card-format,Small Card,https://github.com/pnp/List-Formatting/tree/master/view-samples/small-card-format,David Ramalho,DRamalho92,,,,,,,,,,
View,stat-comparison-chart,Stat Comparison Chart,https://github.com/pnp/sp-dev-list-formatting/tree/master/view-samples/stat-comparison-chart,Anoop Tatti,anoopt,https://raw.githubusercontent.com/pnp/List-Formatting/master/view-samples/stat-comparison-chart/assets/screenshot.png,Format a list view into a chart that shows a comparison between two entities against various attributes,,,Number,,,,,
View,sticky-notes-board-format,Sticky Notes Board Format,https://github.com/pnp/List-Formatting/tree/master/view-samples/sticky-notes-board-format,Tetsuya Kawahara,tecchan1107,https://raw.githubusercontent.com/pnp/List-Formatting/master/view-samples/sticky-notes-board-format/assets/screenshot.gif,This sample demonstrates how to display sticky notes in Board View.,,,,,,,,
View,teams-group-format,teams group format,https://github.com/pnp/List-Formatting/tree/master/view-samples/teams-group-format,André Lage,aaclage,https://raw.githubusercontent.com/pnp/List-Formatting/master/view-samples/teams-group-format/assets/CreateUserGroupChat.gif,This sample uses Microsoft Teams deep links to create Teams chat group based on selected users with associated Group name and message.,,,,,,,,
View,testimonials,Testimonials,https://github.com/pnp/List-Formatting/tree/master/view-samples/testimonials,Andres Ibarra,Riftsan,https://raw.githubusercontent.com/pnp/List-Formatting/master/view-samples/testimonials/assets/screenshot.gif,"This is a template for testimonials (Business Statements), it has nice features such as directional messages, styles, utilizes the current theme colors, image persona hover card, overflow logic and even has some SVG Magic! 🙌",,,,,,,,
View,text-conditional-format,Conditional formatting based on choice field,https://github.com/pnp/sp-dev-list-formatting/tree/master/column-samples/text-conditional-format,Lincoln DeMaris,ldemaris,https://raw.githubusercontent.com/pnp/List-Formatting/master/column-samples/text-conditional-format/assets/screenshot.png,,Y,,General,,,,,
View,tictactoe-format,tic tac toe format,https://github.com/pnp/List-Formatting/tree/master/view-samples/tictactoe-format,André Lage,aaclage,https://raw.githubusercontent.com/pnp/List-Formatting/master/view-samples/tictactoe-format/assets/TicTacToeformat.gif,This sample recreate the tic tac toe game using SharePoint List formatting and new feature setValue.,,,,,,,,
View,tile-layout-example-with-formatting,Items in Tile Layout with images and Formatting for Doclib,https://github.com/pnp/List-Formatting/tree/master/view-samples/tile-layout-example-with-formatting,Niket Jain,NiketJain,https://raw.githubusercontent.com/pnp/List-Formatting/master/view-samples/tile-layout-example-with-formatting/assets/Tile-with-formatting.png,This sample uses tileProps element to format the tile layout  for document libraries.,,,,,,,,
View,tile-layout-example-with-image,Items in Tile Layout with images,https://github.com/pnp/List-Formatting/tree/master/view-samples/tile-layout-example-with-image,Rk Menon,rk-menon,https://raw.githubusercontent.com/pnp/List-Formatting/master/view-samples/tile-layout-example-with-image/assets/tile-layout.png,This sample uses tileProps element to format the tile layout of the view.,,,,,,,,
View,timeline-board-format,Timeline in Board View,https://github.com/pnp/List-Formatting/tree/master/view-samples/timeline-board-format,Tetsuya Kawahara,tecchan1107,https://raw.githubusercontent.com/pnp/List-Formatting/master/view-samples/timeline-board-format/assets/screenshot.png,This sample demonstrates displaying timelines in Board View.,,,,,,,,
View,timeline-format,Timeline Format,https://github.com/pnp/List-Formatting/tree/master/view-samples/timeline-format,Tetsuya Kawahara,tecchan1107,https://raw.githubusercontent.com/pnp/List-Formatting/master/view-samples/timeline-format/assets/horizontal-timeline-format.gif,This sample formats your SharePoint list view to look like a timeline.,,,,,,,,
View,tree-format,Tree format,https://github.com/pnp/List-Formatting/tree/master/view-samples/tree-format,André Lage,aaclage,https://raw.githubusercontent.com/pnp/List-Formatting/master/view-samples/tree-format/assets/ChristmasTree.gif,This sample includes format to add a tree style using column options.,,,,,,,,
View,twitter-format,Twitter Format,https://github.com/pnp/sp-dev-list-formatting/tree/master/view-samples/twitter-format,April Dunham,aprildunnam,https://raw.githubusercontent.com/pnp/List-Formatting/master/view-samples/twitter-format/assets/SPTwitter.gif,"This sample formats your SharePoint list view to look like Twitter. If you are using the Microsoft Flow Templates to track tweets in a SharePoint list, this is a great way to format your list so that it looks more like Twitter. For more info on Flow Templates that take Tweets and add them to a SharePoint list check out this template: https://us.flow.microsoft.com/en-us/galleries/public/templates/e78571e5c70e4806a18eeacba5a897c8/save-tweets-that-include-a-specific-hashtag-to-a-sharepoint-list/",,,Date,,,,,
View,wordle-game-tile-format,Microsoft Lists Wordle Game,https://github.com/pnp/List-Formatting/tree/master/view-samples/wordle-game-tile-format,Tetsuya Kawahara,tecchan1107,https://raw.githubusercontent.com/pnp/List-Formatting/master/view-samples/wordle-game-tile-format/assets/screenshot.gif,This sample reproduces the popular word puzzle game Wordle with Microsoft Lists.,,,,,,,,
Form,blank-header,blank-header,https://github.com/pnp/List-Formatting/tree/master/form-samples/blank-header,Chris Kent,thechriskent,https://raw.githubusercontent.com/pnp/List-Formatting/master/form-samples/blank-header/assets/screenshot.png,"By default, uncustomized list forms display the Title field at the top. This is generally fine, but sometimes you may not want this (especially since the default is to repeat it as the first column). This very basic format removes the default Title display giving you a cleaner form.",,,,,,,,
Form,dashed-line-header,Dashed Line Header,https://github.com/pnp/List-Formatting/tree/master/form-samples/dashed-line-header,Tetsuya Kawahara,tecchan1107,https://raw.githubusercontent.com/pnp/List-Formatting/master/form-samples/dashed-line-header/assets/screenshot.png,"This sample displays the Title and Description values in the heading and decorates them with dashed lines. If the Description value is empty, it will be hidden.",,,,,,,,ms-bgColor-themePrimary|ms-fontColor-white|ms-fontWeight-bold|ms-fontSize-28|ms-fontSize-16
Form,event-itinerary-header,Event Itinerary Header,https://github.com/pnp/List-Formatting/tree/master/form-samples/event-itinerary-header,Tetsuya Kawahara,tecchan1107,https://raw.githubusercontent.com/pnp/List-Formatting/master/form-samples/event-itinerary-header/assets/screenshot.png,"This sample shows a customized header for the item form used in the ""Event itinerary"" list template.",,,,,,,,
Form,ribbon-header,Ribbon Header,https://github.com/pnp/List-Formatting/tree/master/form-samples/ribbon-header,Tetsuya Kawahara,tecchan1107,https://raw.githubusercontent.com/pnp/List-Formatting/master/form-samples/ribbon-header/assets/screenshot.png,This sample demonstrates displaying a ribbon in the header.,,,,,,,,
Form,status-header-footer,status-header-footer,https://github.com/pnp/List-Formatting/tree/master/form-samples/status-header-footer,Chris Kent,thechriskent,,status-header-footer,,,,,,,,
Form,wave-header-footer,Wave header and footer,https://github.com/pnp/List-Formatting/tree/master/form-samples/dashed-line-header,Tetsuya Kawahara,tecchan1107,https://raw.githubusercontent.com/pnp/List-Formatting/master/form-samples/wave-header-footer/assets/screenshot.png,This sample demonstrates how to display waves in the header and footer of a form. Waves are displayed using SVG.,,,,,,,,
Form,workflow-progress-header,Workflow Progress Header,https://github.com/pnp/List-Formatting/tree/master/form-samples/workflow-progress-header,Tetsuya Kawahara,tecchan1107,https://raw.githubusercontent.com/pnp/List-Formatting/master/form-samples/workflow-progress-header/assets/screen_capture.gif,This sample shows a checkmark for each date field that has a value to help convey when milestones have been hit.,,,,,,,,
Form,wrapped-body,wrapped-body,https://github.com/pnp/List-Formatting/tree/master/form-samples/wrapped-body,Chris Kent,thechriskent,,wrapped-body,,,,,,,,
Column,approval-buttons-setValue-status-user,Inline Approval,https://github.com/pnp/list-formatting/tree/master/column-samples/approval-buttons-setValue-status-user,Michel Mendes,michelcarlo,https://raw.githubusercontent.com/pnp/list-formatting/master/column-samples/approval-buttons-setValue-status-user/assets/screenshot.gif,"Creates buttons to approve/reject an (item) by updating an Approval Status field created using a choice field, and also set the value of a person field to the user who took the action by using the setValue action.",,Icons|Inline Editing,General,@me,toLowerCase,setValue,,ms-fontColor-themePrimary|ms-fontColor-themeDarker--hover
Column,color-based-smiley-face,Smiley faces for good quiz results,https://github.com/pnp/list-formatting/tree/master/column-samples/color-based-smiley-face,Siddharth Vaghasia,siddharth-vaghasia,https://raw.githubusercontent.com/pnp/list-formatting/master/column-samples/color-based-smiley-face/assets/screenshot.png,"This sample is to display smiley faces based on color value, As for sample, it is based on color choice column value of",Y,Icons|Status / Progress,General,,,,,
Column,comment-count,comment-count,https://github.com/pnp/List-Formatting/tree/master/column-samples/comment-count,Chris Kent,thechriskent,https://raw.githubusercontent.com/pnp/list-formatting/master/column-samples/comment-count/assets/screenshot.png,comment-count,,Icons,General,,,,,ms-fontColor-themePrimary|ms-fontColor-neutralTertiary
Column,currency-symbol-concatenation,Concatenate Currency Symbol to Numeric Columns,https://github.com/pnp/list-formatting/tree/master/column-samples/currency-symbol-concatenation,S Merchant,sohailmerchant,https://raw.githubusercontent.com/pnp/List-Formatting/master/column-samples/currency-symbol-concatenation/assets/screenshot.png,"This sample will allow the users to concatenate a currency symbol(£, $ ... etc.) to the existing data. This sample will compare two numeric columns and add a currrency symbol. In this example, two columns (Budget Approved and Expenditure To Date) from a Project Register has been used.",Y,,Currency,,,,,
Column,custom-hover-card,Custom hover card on Lists,https://github.com/pnp/list-formatting/tree/master/column-samples/custom-hover-card,Niket Jain,NiketJain,https://raw.githubusercontent.com/pnp/List-Formatting/master/column-samples/custom-hover-card/assets/screenshot.png,The following image shows a list with a custom hover added to a List:,,Icons,General,,,,customCardProps|directionalHint,ms-fontColor-black|ms-fontColor-green|ms-borderColor-neutralSecondaryAlt|ms-fontColor-neutralSecondaryAlt
Column,date-check-blank-format,Formatting a column when a date column is blank,https://github.com/pnp/list-formatting/tree/master/column-samples/date-check-blank-format,Ganesh Sanap,ganesh-sanap,https://raw.githubusercontent.com/pnp/list-formatting/master/column-samples/date-check-blank-format/assets/screenshot.png,"This example populates the text content and applies different classes to the Status field depending on the value inside an item's DueDate field. This example applies formatting to one field by looking at the value inside another field. Note that DueDate is referenced using the `[$FieldName]` syntax. FieldName is assumed to be the internal name of the field. This example also takes advantage of a special value that can be used in date/time fields - `@now`, which resolves to the current date/time, evaluated when the user loads the list view.",,,Date,@now,Number,,,sp-field-severity--good|sp-field-severity--warning|sp-field-severity--blocked
Column,date-compress-format,Compressed Date,https://github.com/pnp/List-Formatting/tree/master/column-samples/date-compress-format,André Lage,aaclage,https://raw.githubusercontent.com/pnp/list-formatting/master/column-samples/date-compress-format/assets/screenshot.png,This sample provide a different style to provide Date in a compress way such us align days and month and display year parallel as vertical.,,Inline Editing,Date,,Date|getDate|getMonth|getYear,,inlineEditField,ms-fontColor-themePrimary|ms-fontColor-themeTertiary|ms-fontColor-themeTertiary--hover|ms-borderColor-themePrimary|ms-fontWeight-bold|ms-fontSize-10|ms-fontSize-16|ms-fontSize-20
Column,date-difference,Date Difference,https://github.com/pnp/List-Formatting/tree/master/column-samples/date-difference,Chris Kent,thechriskent,https://raw.githubusercontent.com/pnp/List-Formatting/master/column-samples/date-difference/assets/screenshot.png,"This sample demonstrates calculating the difference between 2 dates. In this sample the age in years is calculated based on the date of birth and the date of death. This format could easily be adjusted to calculate a different unit of time (months, days, hours, minutes, etc.) by adjusting the multiplier.",,,Date,,Number|floor,,,
Column,date-monthly-emoji,Monthly Emoji,https://github.com/pnp/List-Formatting/tree/master/column-samples/date-monthly-emoji,Tetsuya Kawahara,tecchan1107,https://raw.githubusercontent.com/pnp/List-Formatting/master/column-samples/date-monthly-emoji/assets/screenshot.png,This sample demonstrates how to display a emoji representing the month of the date to the left of the date.,,,Date,,getMonth,,,
Column,date-page-a-day-calendar,Page-a-day Calendar,https://github.com/pnp/List-Formatting/tree/master/column-samples/date-page-a-day-calendar,Tetsuya Kawahara,tecchan1107,https://raw.githubusercontent.com/pnp/List-Formatting/master/column-samples/date-page-a-day-calendar/assets/screenshot.png,"This sample customizes a date column to look like a page-a-day calendar. It does this by using the date part functions (`getDate`, `getMonth`, and `getYear`).",,,Date,,Date|floor|getDate|getMonth|getYear,,,ms-fontColor-themePrimary|ms-fontWeight-bold|ms-bgColor-themePrimary|ms-fontColor-white|ms-borderColor-themePrimary|ms-fontSize-20
Column,date-range-format,Formatting an item when a date column is before or after today's date,https://github.com/pnp/list-formatting/tree/master/column-samples/date-range-format,Vesa Juvonen,VesaJuvonen,https://raw.githubusercontent.com/pnp/List-Formatting/master/column-samples/date-range-format/assets/screenshot.png,"This example colors the current field red when the value inside an item's DueDate is before the current date/time. Unlike some of the previous examples, this example applies formatting to one field by looking at the value inside another field. Note that DueDate is referenced using the [$FieldName] syntax. FieldName is assumed to be the internal name of the field. This example also takes advantage of a special value that can be used in date/time fields - `@now`, which resolves to the current date/time, evaluated when the user loads the list view.",Y,Status / Progress,Date,@now,,,,ms-fontColor-redDark|ms-fontWeight-semibold
Column,date-range-rag,Creating Red-Amber-Green (RAG) bars based on date ranges,https://github.com/pnp/list-formatting/tree/master/column-samples/date-range-rag,Christopher Parker|Joe Ayre,ChrispyBites,https://raw.githubusercontent.com/pnp/List-Formatting/master/column-samples/date-range-rag/assets/screenshot.png,This example creates colored data bars on the current field based on `DueDate` and `StartDate` fields compared to the current date/time.,Y,Severity,Date,@now,Number|Date|floor,,,ms-fontColor-neutralSecondary|sp-field-severity--good|sp-field-severity--warning|sp-field-severity--severeWarning|ms-fontColor-neutralSecondary
Column,date-update-format,date update format,https://github.com/pnp/List-Formatting/tree/master/column-samples/date-update-format,André Lage,aaclage,https://raw.githubusercontent.com/pnp/List-Formatting/master/column-samples/date-update-format/assets/screenshot.gif,Demonstrates updating a date value directly from the format.,,Icons|Inline Editing,Date,@now,Date|toLocaleDateString|length|addDays|addYears,setValue,inlineEditField,
Column,file-thumbnail,File Thumbnails,https://github.com/pnp/list-formatting/tree/master/column-samples/file-thumbnail,Chris Kent|Tetsuya Kawahara,thechriskent,https://raw.githubusercontent.com/pnp/List-Formatting/master/column-samples/file-thumbnail/assets/screenshot.png,Utilizes the @thumbnail placeholder token to create an inline preview for document libraries.,,Document Library,General,@thumbnail,,,customCardProps|directionalHint,
Column,generic-approval-status-hover-card,Approval Status Hover Card,https://github.com/pnp/List-Formatting/tree/master/column-samples/generic-approval-status-hover-card,Django Lohn,m3ngi3,https://raw.githubusercontent.com/pnp/List-Formatting/master/column-samples/generic-approval-status-hover-card/assets/screenshot.png,Adds a hover card with additional details when using Content Approval,,Icons,General,,toLocaleDateString,,customCardProps|directionalHint,ms-fontColor-themePrimary|ms-fontColor-themeDarker--hover|ms-fontColor-black|ms-fontColor-neutralSecondaryAlt|ms-fontColor-red|ms-fontColor-green|ms-fontColor-orange|ms-borderColor-green|ms-borderColor-neutralSecondaryAlt|ms-fontColor-themeDark|ms-fontColor-themeDarker
Column,generic-centered-content,Centered Content,https://github.com/pnp/list-formatting/tree/master/column-samples/generic-centered-content,Chris Kent,thechriskent,https://raw.githubusercontent.com/pnp/List-Formatting/master/column-samples/generic-centered-content/assets/screenshot.png,Demonstrates making your content be both vertically and horizontally centered (in the middle) within the cell.,Y,,General,,,,,
Column,generic-column-chart,Inline Column Chart,https://github.com/pnp/List-Formatting/tree/master/column-samples/generic-column-chart,Tetsuya Kawahara,tecchan1107,https://raw.githubusercontent.com/pnp/List-Formatting/master/column-samples/generic-column-chart/assets/screenshot.png,This sample demonstrates displaying a column chart using SVG. It uses the `currentColor` for the fill value of the SVGs which allows us to use a theme class to make the final SVGs fit your site's theme.,,SVG,General,,,,,ms-fontColor-themePrimary
Column,generic-comment-count,Display Comment Count,https://github.com/pnp/List-Formatting/tree/master/column-samples/generic-comment-count,Tetsuya Kawahara,tecchan1107,https://raw.githubusercontent.com/pnp/List-Formatting/master/column-samples/generic-comment-count/assets/screenshot.png,This sample shows the comment count for a list item.,,Icons,General,,,,,ms-fontColor-themePrimary|ms-fontSize-m
Column,generic-download-file-button,Download File Button,https://github.com/pnp/List-Formatting/tree/master/column-samples/generic-download-file-button,Ganesh Sanap,ganesh-sanap,https://raw.githubusercontent.com/pnp/List-Formatting/master/column-samples/generic-download-file-button/assets/screenshot.png,This sample demonstrates adding a button within a document library view which downloads the file.,,,General,@currentWeb,,,,ms-bgColor-themePrimary|ms-fontColor-white
Column,generic-file-preview,File Preview,https://github.com/pnp/List-Formatting/tree/master/column-samples/generic-file-preview,Geert de Kooter,gdk-max,https://raw.githubusercontent.com/pnp/List-Formatting/master/column-samples/generic-file-preview/assets/screenshot.png,This sample opens Microsoft Office documents in full screen within a new tab. This is the same view as used in the fileviewer webpart (no toolbars).,,Icons,General,@currentWeb,,,,ms-fontColor-themePrimary|ms-fontColor-themeDark|ms-fontColor-themeDark--hover
Column,generic-flow-status,generic-flow-status,https://github.com/pnp/List-Formatting/tree/master/column-samples/generic-flow-status,Chris Kent,thechriskent,https://raw.githubusercontent.com/pnp/List-Formatting/master/column-samples/generic-flow-status/assets/screenshot.png,generic-flow-status,,Icons|SVG|Power Automate,General,,startsWith,executeFlow,customCardProps,ms-fontColor-themePrimary|ms-fontColor-themePrimary--hover|ms-bgColor-themeTertiary|ms-bgColor-themeTertiary--hover|ms-fontColor-neutralPrimary|ms-fontColor-neutralSecondary|ms-bgColor-white|ms-font-xl|ms-font-l
Column,generic-hyperlink-thumbnail,Turn FileRef field into thumbnail image or clickable hyperlink,https://github.com/pnp/list-formatting/tree/master/column-samples/generic-hyperlink-thumbnail,Josef Lahmer,josy1024,https://raw.githubusercontent.com/pnp/List-Formatting/master/column-samples/generic-hyperlink-thumbnail/assets/screenshot.png,This example uses a column to generate a hyperlink to the Item Thumbnail for a document library.,Y,Document Library,General,@currentWeb,,,,
Column,generic-hyperlink-values,Turn field values into hyperlinks,https://github.com/pnp/list-formatting/tree/master/column-samples/generic-hyperlink-values,Vesa Juvonen,VesaJuvonen,https://raw.githubusercontent.com/pnp/List-Formatting/master/column-samples/generic-hyperlink-values/assets/screenshot.png,"This example shows how to turn a text field that contains stock ticker symbols into a hyperlink that targets the Yahoo Finance real-time quotes page for that stock ticker. The example uses a `+` operator that appends the current field value to the static hyperlink <a>http://finance.yahoo.com/quote/</a>. You can extend this pattern to any scenario in which you want users to view contextual information related to an item, or you want to start a business process on the current item, as long as the information or process can be accessed via a hyperlink parameterized with values from the list item.",Y,,General,,,,,
Column,generic-icon-overlay,Icon Overlays,https://github.com/pnp/List-Formatting/tree/master/column-samples/generic-icon-overlay,Chris Kent,thechriskent,https://raw.githubusercontent.com/pnp/List-Formatting/master/column-samples/generic-icon-overlay/assets/screenshot.png,You can UI Fabric Icons within your column and view formats. This sample demonstrates combining multiple icons by overlaying to create colorful icons that can indicate more information than a single icon can.,,Icons,General,,,,,ms-fontColor-black|ms-fontColor-yellow|ms-fontColor-themePrimary|ms-fontColor-green|ms-fontColor-blue|ms-fontColor-magentaLight|ms-fontColor-redDark|ms-fontColor-red
Column,generic-issuestatus-pill,"Issue Status Pill ",https://github.com/pnp/List-Formatting/tree/master/column-samples/generic-issuestatus-pill,Hugo Bernier,hugoabernier,https://raw.githubusercontent.com/pnp/List-Formatting/master/column-samples/generic-issuestatus-pill/assets/screenshot.png,This format demonstrates how you can reproduce the status choices as pills found in the Microsoft Lists Issue Tracker template..,,Icons,General,,,,,sp-css-backgroundColor-errorBackground50|sp-css-backgroundColor-errorBackground|sp-css-color-redDark|sp-css-backgroundColor-neutralBackground10|sp-css-backgroundColor-successBackground40|sp-css-color-green|sp-css-backgroundColor-warningBackground50|sp-css-color-themeDarker|sp-css-backgroundColor-blueBackground07|sp-css-backgroundColor-blueBackground17|sp-css-color-neutralPrimary|sp-css-color-blue|sp-css-color-red|sp-css-backgroundColor-blue|sp-css-color-themeDark
Column,generic-launch-powerapp,Launch Power App Button,https://github.com/pnp/List-Formatting/tree/master/column-samples/generic-launch-powerapp,Chris Kent,thechriskent,https://raw.githubusercontent.com/pnp/List-Formatting/master/column-samples/generic-launch-powerapp/assets/screenshot.png,Providing a direct link to an item within Power Apps is easy to do using this sample. To use it follow the instructions below to get the link to your Power App (and replace that portion of the format).,,Power Apps|Icons,General,,,,,ms-fontColor-themePrimary|ms-fontColor-themeDark|ms-fontColor-themeDark--hover|ms-font-xxl
Column,generic-likedby,Display users who have liked,https://github.com/pnp/List-Formatting/tree/master/column-samples/generic-likedby,Tetsuya Kawahara,tecchan1107,https://raw.githubusercontent.com/pnp/List-Formatting/master/column-samples/generic-likedby/assets/screenshot.png,This sample demonstrates showing the users who have liked an item.,,Icons,General,,getUserImage,,forEach|customCardProps|directionalHint,ms-bgColor-themePrimary|ms-bgColor-themeTertiary|ms-bgColor-themeTertiary--hover|ms-fontColor-white
