Type,Name,Title,Link,Author,AuthorGH,ScreenshotUrl,Description,SP2019,Categories,ColumnTypes,Tokens,Operators,Actions,Features,Classes
Column,generic-like-unlike,Like/Unlike List Item,https://github.com/pnp/List-Formatting/tree/master/column-samples/generic-like-unlike,Ganesh Sanap,ganesh-sanap,https://raw.githubusercontent.com/pnp/List-Formatting/master/column-samples/generic-like-unlike/assets/screenshot.gif,Demonstrates how to like/unlike a list item.,,Icons|Inline Editing,General,@me,indexOf|appendTo|removeFrom,setValue,,ms-fontColor-themePrimary
Column,generic-mailto-button,Mail To Button,https://github.com/pnp/List-Formatting/tree/master/column-samples/generic-mailto-button,Chris Kent,thechriskent,https://raw.githubusercontent.com/pnp/List-Formatting/master/column-samples/generic-mailto-button/assets/screenshot.png,This sample demonstrates making a mailto link (opens email with prepopulated values) button that references a different field.,,Icons,General,,,,,ms-fontColor-themePrimary|ms-fontColor-themeDark|ms-fontColor-themeDark--hover|ms-font-xxl
Column,generic-project-management,Project Indicator Formats,https://github.com/pnp/List-Formatting/tree/master/column-samples/generic-project-management,Chris Kent,thechriskent,https://raw.githubusercontent.com/pnp/List-Formatting/master/column-samples/generic-project-management/assets/screenshot.png,Three related formats for use in project management.,,Icons,General,,,,,ms-fontColor-white|ms-bgColor-yellow|ms-bgColor-orange|ms-bgColor-orangeLight|ms-bgColor-orangeLighter|ms-bgColor-red|ms-bgColor-green|sp-field-trending--up|sp-field-trending--down
Column,generic-right-align,Centered Content,https://github.com/pnp/List-Formatting/tree/master/column-samples/generic-right-align,Mike Honey,Mike-Honey,https://raw.githubusercontent.com/pnp/List-Formatting/master/column-samples/generic-right-align/assets/screenshot.png,"This sample shows how to right-align your content, while preserving the number or date format set using the SharePoint / Lists UI.  Numbers and dates should typically be presented as right-aligned, for improved readability.",,,General,,,,,
Column,generic-rowactions,Row Actions,https://github.com/pnp/List-Formatting/tree/master/column-samples/generic-rowactions,Chris Kent,thechriskent,https://raw.githubusercontent.com/pnp/List-Formatting/master/column-samples/generic-rowactions/assets/screenshot.png,You can use column and view formatting to create buttons that perform pre-defined actions when clicked. This sample provides a quick format that demonstrates the use of each of the possible actions.,,Icons,General,,,delete|editProps|executeFlow|defaultClick|share,,ms-fontColor-themePrimary|ms-fontColor-themeDark|ms-fontColor-themeDark--hover|ms-font-xxl
Column,generic-rowIndex-drawing,Row Index Drawing,https://github.com/pnp/List-Formatting/tree/master/column-samples/generic-rowIndex-drawing,Chris Kent,thechriskent,https://raw.githubusercontent.com/pnp/List-Formatting/master/column-samples/generic-rowIndex-drawing/assets/screenshot.gif,This is a silly format that draws a picture in your view using the @rowIndex token to adjust the colors and to determine when certain pictures (icons or SVG elements) should show up.,,Icons|SVG,General,@rowIndex,,,,ms-fontColor-neutralPrimary|ms-fontColor-yellow
Column,generic-scheduling-link,Linking to the scheduling dialog in Microsoft Teams and Microsoft Outlook,https://github.com/pnp/List-Formatting/tree/master/column-samples/generic-scheduling-link,Tetsuya Kawahara,tecchan1107,https://raw.githubusercontent.com/pnp/List-Formatting/master/column-samples/generic-scheduling-link/assets/screenshot.png,This sample demonstrates creating deep links to the scheduling dialog in Microsoft Teams and Microsoft Outlook.,,Teams|Icons,General,,toString|Number|Date|toLocaleTimeString|indexOf|substring|getDate|getMonth|getYear|padStart,,,ms-fontSize-xxl|ms-fontColor-themePrimary
Column,generic-socialpic,Display Social Media Profile Pics Using Social Media Handles,https://github.com/pnp/list-formatting/tree/master/column-samples/generic-socialpic,David Warner II,PopWarner,https://raw.githubusercontent.com/pnp/List-Formatting/master/column-samples/generic-socialpic/assets/screenshot.png,Social media profile pictures are displayed in a circle and clicking them will open the user's social media page in a new window..,Y,,General,,,,,
Column,generic-start-flow,Create a button to launch a Flow for the selected item,https://github.com/pnp/list-formatting/tree/master/column-samples/generic-start-flow,Yannick Borghmans,yborghmans,https://raw.githubusercontent.com/pnp/List-Formatting/master/column-samples/generic-start-flow/assets/screenshot.png,"You can use column formatting to create buttons that, when clicked, run Flows on the corresponding list item. The Flow Launch Panel will be displayed after clicking the button allowing the user to specify any required data and then run the flow.",,Icons|Power Automate,General,,,executeFlow,,ms-fontColor-themePrimary|ms-fontColor-themeDark|ms-fontColor-themeDarker|ms-fontColor-themeDarker--hover
Column,generic-start-flow-conditionally,Create a button to conditionally launch a Flow for the selected item,https://github.com/pnp/list-formatting/tree/master/column-samples/generic-start-flow-conditionally,Chris Kent,thechriskent,https://raw.githubusercontent.com/pnp/List-Formatting/master/column-samples/generic-start-flow-conditionally/assets/screenshot.gif,"You can use column formatting to create buttons that, when clicked, run Flows on the corresponding list item. The Flow Launch Panel will be displayed after clicking the button allowing the user to specify any required data and then run the flow. This is demonstrated in the [Generic-Start-Flow](../generic-start-flow) sample.",,Icons|Power Automate,General,,,executeFlow,,ms-fontColor-orangeLight|ms-fontColor-teal|ms-fontColor-redDark
Column,generic-staticmap,Displays a customizable Google map image for a given location,https://github.com/pnp/list-formatting/tree/master/column-samples/generic-staticmap,Chris Kent,thechriskent,https://raw.githubusercontent.com/pnp/List-Formatting/master/column-samples/generic-staticmap/assets/screenshot.png,"This template takes advantage of Google Maps' [staticmap API](https://developers.google.com/maps/documentation/static-maps/) which generates an image using a parameterized URL. The template only uses the most basic features ([location](https://developers.google.com/maps/documentation/static-maps/intro#Locations) & [image size](https://developers.google.com/maps/documentation/static-maps/intro#Imagesizes), but the API offers deep customization including:",Y,,General,,,,,
Column,generic-substring-status,Substring Status,https://github.com/pnp/List-Formatting/tree/master/column-samples/generic-substring-status,Chris Kent,thechriskent,https://raw.githubusercontent.com/pnp/List-Formatting/master/column-samples/generic-substring-status/assets/screenshot.png,This format demonstrates using a combination of the substring and indexOf operations to 'split' a value and make style decisions based on portions of the value.,,Icons,General,,indexOf|substring,,,ms-fontColor-redDark|ms-fontColor-yellow|ms-fontColor-green
Column,generic-svgicon-format,SVG icons,https://github.com/pnp/list-formatting/tree/master/column-samples/generic-svgicon-format,Chris Kent,thechriskent,https://raw.githubusercontent.com/pnp/List-Formatting/master/column-samples/generic-svgicon-format/assets/screenshot.png,"The Fluent UI icons are easy to use in column formatting by simply specifying the name in the iconName attribute. However, the available selection of icons may not always meet your needs. Fortunately, you can use inline SVG elements with custom paths. This means you can use icons from sources like Font Awesome that provide SVG versions of their icons!",Y,SVG|Icons,General,,,,,
Column,generic-timeline,Timeline Format,https://github.com/pnp/List-Formatting/tree/master/column-samples/generic-timeline,Tetsuya Kawahara,tecchan1107,https://raw.githubusercontent.com/pnp/List-Formatting/master/column-samples/generic-timeline/assets/screenshot.png,"This sample demonstrates displaying a timeline in a column. If the column value is empty, no circle will be displayed. The content of the column will be shown in a popup when you click on the dot.",,,General,,,,customCardProps|directionalHint,ms-bgColor-themePrimary|ms-bgColor-neutralSecondary|ms-bgColor-neutralSecondaryAlt
Column,generic-time-schedule,Time Schedule,https://github.com/pnp/List-Formatting/tree/master/column-samples/generic-time-schedule,Tetsuya Kawahara,tecchan1107,https://raw.githubusercontent.com/pnp/List-Formatting/master/column-samples/generic-time-schedule/assets/screenshot.png,This sample demonstrates a time schedule with a filled background from Start time to End time.,,SVG,General,,Number|substring,,,ms-fontColor-themePrimary|ms-fontWeight-bold
Column,generic-twitterpic,Display Twitter profile pics using Twitter handles,https://github.com/pnp/list-formatting/tree/master/column-samples/generic-twitterpic,Chris Kent,thechriskent,https://raw.githubusercontent.com/pnp/List-Formatting/master/column-samples/generic-twitterpic/assets/screenshot.png,"Using just the Twitter handle, Twitter profile pictures are displayed in a circle and clicking them will open the user's Twitter page in a new window. The handle is also displayed as a tooltip when hovering over the profile image.",Y,,General,,,,,
Column,generic-yearly-gantt-chart,Yearly Gantt Chart,https://github.com/pnp/List-Formatting/tree/master/column-samples/generic-yearly-gantt-chart,Tetsuya Kawahara,tecchan1107,https://raw.githubusercontent.com/pnp/List-Formatting/master/column-samples/generic-yearly-gantt-chart/assets/screenshot.png,This sample demonstrates the display of a yearly Gantt chart.,,,General,,Number|Date|getYear,,customCardProps|directionalHint,ms-fontColor-themePrimary|ms-bgColor-themePrimary|ms-bgColor-themeTertiary|ms-bgColor-themeTertiary--hover|ms-fontWeight-bold|ms-fontSize-l
Column,generic-youtube-thumbnail,YouTube Thumbnail,https://github.com/pnp/List-Formatting/tree/master/column-samples/generic-youtube-thumbnail,João Ferreira,joaoferreira,https://raw.githubusercontent.com/pnp/List-Formatting/master/column-samples/generic-youtube-thumbnail/assets/screenshot.gif,This sample provides a thumbnail of a YouTube video that links to the video and a larger preview image on hover.,,,General,,indexOf|substring,,customCardProps|beakStyle|directionalHint,
Column,hyperlink-click-count,Count the number of clicks on a link,https://github.com/pnp/List-Formatting/tree/master/column-samples/hyperlink-click-count,Tetsuya Kawahara,tecchan1107,https://raw.githubusercontent.com/pnp/List-Formatting/master/column-samples/hyperlink-click-count/assets/screenshot.gif,This sample demonstrates counting the number of clicks on a link.,,Inline Editing,Hyperlink,,,setValue,,ms-fontColor-themePrimary|ms-bgColor-themePrimary|ms-bgColor-themePrimary--hover|ms-bgColor-themeLight|ms-bgColor-themeLighter|ms-fontColor-white|ms-fontColor-white--hover
Column,image-lightbox,Image Lightbox,https://github.com/pnp/List-Formatting/tree/master/column-samples/image-lightbox,João Ferreira|Chris Kent,joaoferreira,https://raw.githubusercontent.com/pnp/List-Formatting/master/column-samples/image-lightbox/assets/screenshot.gif,This sample demonstrates showing the full size image in a lightbox (hover card) rather than opening this image in a new window.,,Icons,Image,@window.innerHeight|@window.innerWidth,ceiling,,customCardProps|beakStyle|directionalHint,ms-fontColor-themeLight|ms-fontColor-themeLight--hover|ms-fontColor-white|ms-bgColor-black
Column,location-address,Display Location Address Details,https://github.com/pnp/list-formatting/tree/master/column-samples/location-address,Chris Kent,thechriskent,https://raw.githubusercontent.com/pnp/List-Formatting/master/column-samples/location-address/assets/screenshot.png,Location columns provide several properties that can be accessed to provide more information to users. This sample pulls out sub properties to turn the standard Display Name only to a full address and provides a link to Bing Maps for a given location.,,,Location,,,,,
Column,location-weather,Display Location Weather Details,https://github.com/pnp/list-formatting/tree/master/column-samples/location-weather,Chris Kent,thechriskent,https://raw.githubusercontent.com/pnp/List-Formatting/master/column-samples/location-weather/assets/screenshot.png,This sample utilizes sub properties of a Location column to build an image that pulls weather from WeatherForYou.com,,,Location,,,,,
Column,managed-metadata-tag-icon,Managed Metadata Tag Icon,https://github.com/pnp/List-Formatting/tree/master/column-samples/managed-metadata-tag-icon,Tetsuya Kawahara,tecchan1107,https://raw.githubusercontent.com/pnp/List-Formatting/master/column-samples/managed-metadata-tag-icon/assets/screenshot.png,This sample displays a tag icon to the left of the value in the managed metadata column.,,Icons,Managed Metadata,,,,forEach,ms-bgColor-themePrimary|ms-fontColor-white|ms-font-s
Column,multi-choice-foreach,Multi-Choice forEach,https://github.com/pnp/list-formatting/tree/master/column-samples/multi-choice-foreach,Chris Kent,thechriskent,https://raw.githubusercontent.com/pnp/List-Formatting/master/column-samples/multi-choice-foreach/assets/screenshot.png,This sample demonstrates usage of the forEach property to create template elements applied to each choice in a multi-select choice field.,,,Multi-Choice,,,,forEach,ms-bgColor-themePrimary|ms-fontColor-white
Column,multi-choice-icons,Multi-Choice Icons,https://github.com/pnp/list-formatting/tree/master/column-samples/multi-choice-icons,Chris Kent,thechriskent,https://raw.githubusercontent.com/pnp/List-Formatting/master/column-samples/multi-choice-icons/assets/screenshot.png,"This sample demonstrates using the indexOf and join functions (O365 only) to test if a multi-select choice field has a selected choice. Providing icons of the known choices and applying themed colors based on if the given choice is selected or not creates an intuitive, easy to understand visualization that doesn't suffer from varying item order or text formatting issues.",,Icons,Multi-Choice,,indexOf|join,,,ms-fontColor-themeDark|ms-fontColor-neutralLight
Column,multi-choice-links,Multi choice Links,https://github.com/pnp/list-formatting/tree/master/column-samples/multi-choice-links,Anoop Tatti,anoopt,https://raw.githubusercontent.com/pnp/List-Formatting/master/column-samples/multi-choice-links/assets/screenshot.png,This sample shows how we can display multiple links in a single column using the multi-choice column.,,,Multi-Choice,,indexOf|substring|lastIndexOf,,forEach,ms-bgColor-themeLight|ms-bgColor-themeLighter--hover|ms-fontColor-themeDark|ms-fontWeight-regular|ms-fontSize-sPlus|ms-fontSize-s
Column,multi-choice-workcategory-pill,"Work Progress Category Pill ",https://github.com/pnp/list-formatting/tree/master/column-samples/multi-choice-workcategory-pill,Ganesh Sanap,ganesh-sanap,https://raw.githubusercontent.com/pnp/List-Formatting/master/column-samples/multi-choice-workcategory-pill/assets/screenshot.png,This JSON sample demonstrates how you can format the work progress category choices as pills found in the newly released Microsoft Lists Work progress tracker template.,,Icons,Multi-Choice,,,,forEach,sp-css-backgroundColor-errorBackground|sp-css-backgroundColor-warningBackground|sp-css-backgroundColor-successBackground|sp-css-backgroundColor-blue|sp-css-backgroundColor-neutralBackground|sp-css-backgroundColor-blueBackground07|sp-field-borderBottomRegular
Column,multi-lookup-projected-field,Multi-lookup fields and projected fields,https://github.com/pnp/List-Formatting/tree/master/column-samples/multi-lookup-projected-field,Chris Kent,thechriskent,https://raw.githubusercontent.com/pnp/List-Formatting/master/column-samples/multi-lookup-projected-field/assets/screenshot.png,"Lookup columns that support multiple values can be formatted using the advanced `forEach` property. Unfortunately, the way values are returned for any projected fields (additional columns associated to your lookup column) can present unique challenges. This sample provides two formats illustrating the difference in how these columns are formatted.",,,Multi-Lookup,,indexOf|substring,,forEach,
Column,multi-person-currentuser,Highlight the current user,https://github.com/pnp/list-formatting/tree/master/column-samples/multi-person-currentuser,Chris Kent,thechriskent,https://raw.githubusercontent.com/pnp/List-Formatting/master/column-samples/multi-person-currentuser/assets/screenshot.png,This sample uses the @me keyword to check if the person field contains the current user and shows that entry using a different color and weight. This is a dynamic check that will always highlight the user using the list (not the creater of the format). This template could easily be extended to apply different/additional styles or icons as desired by simply copying the same expression logic for other fields.,,,Multi-Person,@me,indexOf|join,,,ms-fontColor-themePrimary|ms-fontWeight-semibold
Column,multi-person-facepile,Multi-Person Facepile,https://github.com/pnp/list-formatting/tree/master/column-samples/multi-person-facepile,Chris Kent,thechriskent,https://raw.githubusercontent.com/pnp/List-Formatting/master/column-samples/multi-person-facepile/assets/screenshot.png,This sample provides rounded images for each person in a multi-select person field.,,,Multi-Person,@currentWeb,toString|loopIndex|join|length,,forEach,ms-fontColor-neutralSecondary|ms-bgColor-neutralLight
Column,multi-person-mailto,Multi-Person Mail To Link,https://github.com/pnp/list-formatting/tree/master/column-samples/multi-person-mailto,Ganesh Sanap,ganesh-sanap,https://raw.githubusercontent.com/pnp/List-Formatting/master/column-samples/multi-person-mailto/assets/screenshot.png,This column formatting sample demonstrates how to add a mailto: link for each person in a multiple selection person column.,,Icons,Multi-Person,,,,forEach,ms-fontColor-themePrimary|sp-field-quickAction
Column,multi-person-reaction,Reacting and displaying users who have reacted,https://github.com/pnp/List-Formatting/tree/master/column-samples/multi-person-reaction,Tetsuya Kawahara,tecchan1107,https://raw.githubusercontent.com/pnp/List-Formatting/master/column-samples/multi-person-reaction/assets/screenshot.gif,This sample demonstrates how to react and display users who have reacted.,,Inline Editing,Multi-Person,@me,indexOf|length|getUserImage|appendTo|removeFrom,setValue,forEach|customCardProps|directionalHint,ms-bgColor-themeTertiary--hover
Column,multi-person-teams-chat-link,Multi-Person Teams Chat Link,https://github.com/pnp/List-Formatting/tree/master/column-samples/multi-person-teams-chat-link,Chris Kent,thechriskent,https://raw.githubusercontent.com/pnp/List-Formatting/master/column-samples/multi-person-teams-chat-link/assets/screenshot.png,This sample demonstrates creating a deep link to a Microsoft Teams chat. This format works both within Microsoft Teams and within SharePoint Online.,,Icons,Multi-Person,,join,,,ms-fontColor-themePrimary|ms-fontColor-themeDark--hover
Column,multi-person-unique-reaction,Like / Dislike - Unique reaction,https://github.com/pnp/list-formatting/tree/master/column-samples/multi-person-unique-reaction,Michel Mendes,michelcarlo,https://raw.githubusercontent.com/pnp/List-Formatting/master/column-samples/multi-person-unique-reaction/assets/screenshot.gif,This sample provides rounded images for each person in a multi-select person field.,,Icons|Inline Editing,Multi-Person,@me,indexOf|length|appendTo|removeFrom,setValue,,ms-fontColor-themePrimary|ms-fontColor-themeDarker--hover
Column,number-abs-tolerance-comparison,Determine Tolerance Comparison using abs(),https://github.com/pnp/list-formatting/tree/master/column-samples/number-abs-tolerance-comparison,David Warner II,PopWarner,https://raw.githubusercontent.com/pnp/List-Formatting/master/column-samples/number-abs-tolerance-comparison/assets/screenshot.png,Display if a value is within the expected tolerance.,,Icons,Number,,abs,,,sp-field-trending--up|sp-field-trending--down
Column,number-background-color-shading,Background color shading by number column value,https://github.com/pnp/List-Formatting/tree/master/column-samples/number-background-color-shading,Tetsuya Kawahara,tecchan1107,https://raw.githubusercontent.com/pnp/List-Formatting/master/column-samples/number-background-color-shading/assets/screenshot.png,This sample demonstrates how to change the shade of the background color according to the value of the number column.,,,Number,,,,,ms-bgColor-themeTertiary
Column,number-battery,Number Battery,https://github.com/pnp/List-Formatting/tree/master/column-samples/number-battery,Tetsuya Kawahara,tecchan1107,https://raw.githubusercontent.com/pnp/List-Formatting/master/column-samples/number-battery/assets/screenshot.png,This sample changes the appearance of the values in number columns (percent)  to look like a battery.,,,Number,,,,,ms-fontColor-neutralPrimary|ms-bgColor-neutralPrimary|ms-bgColor-yellow|ms-bgColor-red|ms-bgColor-tealLight|ms-fontColor-themePrimary|ms-bgColor-themePrimary|ms-bgColor-themeLight
Column,number-circle-in-circle,Number Circle in Circle,https://github.com/pnp/List-Formatting/tree/master/column-samples/number-circle-in-circle,Geert de Kooter,gdk-max,https://raw.githubusercontent.com/pnp/List-Formatting/master/column-samples/number-circle-in-circle/assets/screenshot.png,This sample shows how the percentage value in a column can be displayed as the area of a circle within another circle.,,SVG,Number,,pow,,,ms-bgColor-themeLight|ms-fontColor-themePrimary|ms-bgColor-white|ms-fontColor-themeDarker
Column,number-conditional-format,Conditional formatting based on a number range,https://github.com/pnp/list-formatting/tree/master/column-samples/number-conditional-format,Vesa Juvonen,VesaJuvonen,https://raw.githubusercontent.com/pnp/List-Formatting/master/column-samples/number-conditional-format/assets/screenshot.png,"This example uses the conditional operator ? to apply a class (sp-field-severity--warning) to the parent div element when the value in the current field is less than or equal to 70. This causes the field to be highlighted when the value is less than or equal to 70, and appear normally if it's greater than 70.",Y,Icons,Number,,,,,sp-field-severity--warning
Column,number-conditional-progress-color,Conditional Progress Color,https://github.com/pnp/list-formatting/tree/master/column-samples/number-conditional-progress-color,Ari Gunawan,AriGunawan,https://raw.githubusercontent.com/pnp/List-Formatting/master/column-samples/number-conditional-progress-color/assets/screenshot.png,This sample demonstrates displaying progress bar with conditional color based on the value.,Y,,Number,,,,,ms-fontColor-alert|sp-css-backgroundColor-errorBackground40|sp-css-borderTop-errorBorder|ms-fontColor-sharedOrange20|ms-fontColor-sharedGreenCyan10|sp-css-backgroundColor-warningBackground40|sp-css-borderTop-warningBorder|sp-css-backgroundColor-successBackground40|sp-css-borderTop-successBorder
Column,number-countup-countdown,Display count-up and count-down buttons,https://github.com/pnp/List-Formatting/tree/master/column-samples/number-countup-countdown,Tetsuya Kawahara,tecchan1107,https://raw.githubusercontent.com/pnp/List-Formatting/master/column-samples/number-countup-countdown/assets/screenshot.gif,This sample demonstrates a button with a number increasing by one and a button with a number decreasing by one.,,Icons|Inline Editing,Number,,,setValue,,ms-bgColor-themePrimary|ms-bgColor-themeDark--hover|ms-fontColor-white
Column,number-data-bar,Format a number column as a data bar,https://github.com/pnp/list-formatting/tree/master/column-samples/number-data-bar,Vesa Juvonen|Chris Kent,VesaJuvonen,https://raw.githubusercontent.com/pnp/List-Formatting/master/column-samples/number-data-bar/assets/screenshot.png,"These formats apply background-color and border-top styles to create a data bar visualization of @currentField, which is a number field. These styles are applied using the special column formatting class sp-field-dataBars. The bars are sized differently for different values based on the way the width attribute of the main div is set.",Y,,Number,,toString,,,sp-field-dataBars
Column,number-data-bar-multi-color,Multi-Colored Databars,https://github.com/pnp/list-formatting/tree/master/column-samples/number-data-bar-multi-color,Ganesh Sanap,ganesh-sanap,https://raw.githubusercontent.com/pnp/List-Formatting/master/column-samples/number-data-bar-multi-color/assets/screenshot.png,This column formatting sample demonstrates how to show the number column as data bars with multiple colors.,Y,,Number,,,,,
Column,number-doughnut-chart,Doughnut Chart,https://github.com/pnp/List-Formatting/tree/master/column-samples/number-doughnut-chart,Tetsuya Kawahara,tecchan1107,https://raw.githubusercontent.com/pnp/List-Formatting/master/column-samples/number-doughnut-chart/assets/screenshot.png,Changes the appearance of the values in number columns (percent) to a donut chart.,,Icons|SVG,Number,,cos|sin,,customCardProps|directionalHint,ms-fontColor-themePrimary|ms-fontColor-neutralQuaternaryAlt
Column,number-emoji-progressbar,Progress bar using text or emoji,https://github.com/pnp/List-Formatting/tree/master/column-samples/number-emoji-progressbar,Tetsuya Kawahara,tecchan1107,https://raw.githubusercontent.com/pnp/List-Formatting/master/column-samples/number-emoji-progressbar/assets/screenshot.png,This sample demonstrates the use of text symbols and emoji to display a progress bar.,,,Number,,padStart,,,ms-fontColor-themePrimary
